{
  "account_id": "bens",
  "company_name": "",
  "business_hours": {
    "days": [
      "Monday",
      "Tuesday",
      "Wednesday",
      "Thursday",
      "Friday"
    ],
    "start": "",
    "end": "",
    "timezone": ""
  },
  "office_address": "",
  "services_supported": [
    "replacement",
    "service calls",
    "upgrade",
    "installation services",
    "project",
    "maintenance services",
    "renovation"
  ],
  "emergency_definition": [],
  "emergency_routing_rules": [],
  "non_emergency_routing_rules": [],
  "call_transfer_rules": {
    "timeout_seconds": 60
  },
  "integration_constraints": [
    "Uses Jobber CRM"
  ],
  "after_hours_flow_summary": "",
  "office_hours_flow_summary": "",
  "questions_or_unknowns": [],
  "notes": ""
}