{
  "account_id": "test",
  "company_name": "Test Fire Protection.",
  "business_hours": {
    "days": [
      "Monday",
      "Tuesday",
      "Wednesday",
      "Thursday",
      "Friday"
    ],
    "start": "8:00 AM",
    "end": "5:00 PM",
    "timezone": "Not specified"
  },
  "office_address": "",
  "services_supported": [],
  "emergency_definition": [
    "Sprinkler leak",
    "Fire alarm triggered"
  ],
  "emergency_routing_rules": [],
  "non_emergency_routing_rules": [],
  "call_transfer_rules": {
    "timeout_seconds": 60
  },
  "integration_constraints": [
    "Never create sprinkler jobs in ServiceTrade"
  ],
  "after_hours_flow_summary": "",
  "office_hours_flow_summary": "",
  "questions_or_unknowns": [],
  "notes": ""
}